[
  {
    "riskId": "R-SQL-001",
    "service": "order-service",
    "category": "SQLI",
    "severity": "P1",
    "status": "Open",
    "codeEvidence": [
      "OrderDao.java:8"
    ],
    "serviceLevelSummary": "Dynamic SQL concatenation in order lookup"
  },
  {
    "riskId": "R-AUTH-001",
    "service": "order-service",
    "category": "AUTH",
    "severity": "P1",
    "status": "Open",
    "codeEvidence": [
      "OrderController.java:17"
    ],
    "serviceLevelSummary": "Order API may lack authentication enforcement"
  }
]
